[
  {
    "is_synthetic": true,
    "id": "TEL-0001",
    "ticket_id": "WO-0004",
    "device_id": "DEV-080",
    "sampled_at": "2026-10-23T12:50:00Z",
    "source": "synthetic_read_only_snapshot",
    "fields": {
      "soc_percent": 37,
      "network_status": "offline",
      "data_freshness_minutes": 180
    },
    "interpretation": "只读样本，不能仅凭该快照判断根因；不提供远程控制指令。"
  },
  {
    "is_synthetic": true,
    "id": "TEL-0002",
    "ticket_id": "WO-0008",
    "device_id": "DEV-184",
    "sampled_at": "2026-10-22T23:42:00Z",
    "source": "synthetic_read_only_snapshot",
    "fields": {
      "soc_percent": 24,
      "network_status": "offline",
      "data_freshness_minutes": 180
    },
    "interpretation": "只读样本，不能仅凭该快照判断根因；不提供远程控制指令。"
  },
  {
    "is_synthetic": true,
    "id": "TEL-0003",
    "ticket_id": "WO-0012",
    "device_id": "DEV-054",
    "sampled_at": "2026-10-22T10:34:00Z",
    "source": "synthetic_read_only_snapshot",
    "fields": {
      "soc_percent": 54,
      "network_status": "online",
      "data_freshness_minutes": 2
    },
    "interpretation": "只读样本，不能仅凭该快照判断根因；不提供远程控制指令。"
  },
  {
    "is_synthetic": true,
    "id": "TEL-0004",
    "ticket_id": "WO-0016",
    "device_id": "DEV-158",
    "sampled_at": "2026-10-21T21:26:00Z",
    "source": "synthetic_read_only_snapshot",
    "fields": {
      "soc_percent": 17,
      "network_status": "online",
      "data_freshness_minutes": 2
    },
    "interpretation": "只读样本，不能仅凭该快照判断根因；不提供远程控制指令。"
  },
  {
    "is_synthetic": true,
    "id": "TEL-0005",
    "ticket_id": "WO-0020",
    "device_id": "DEV-050",
    "sampled_at": "2026-10-23T15:33:00Z",
    "source": "synthetic_read_only_snapshot",
    "fields": {
      "soc_percent": 39,
      "network_status": "online",
      "data_freshness_minutes": 2
    },
    "interpretation": "只读样本，不能仅凭该快照判断根因；不提供远程控制指令。"
  },
  {
    "is_synthetic": true,
    "id": "TEL-0006",
    "ticket_id": "WO-0024",
    "device_id": "DEV-132",
    "sampled_at": "2026-10-20T19:10:00Z",
    "source": "synthetic_read_only_snapshot",
    "fields": {
      "soc_percent": 82,
      "network_status": "online",
      "data_freshness_minutes": 2
    },
    "interpretation": "只读样本，不能仅凭该快照判断根因；不提供远程控制指令。"
  },
  {
    "is_synthetic": true,
    "id": "TEL-0007",
    "ticket_id": "WO-0028",
    "device_id": "DEV-048",
    "sampled_at": "2026-10-20T06:02:00Z",
    "source": "synthetic_read_only_snapshot",
    "fields": {
      "soc_percent": 22,
      "network_status": "online",
      "data_freshness_minutes": 2
    },
    "interpretation": "只读样本，不能仅凭该快照判断根因；不提供远程控制指令。"
  },
  {
    "is_synthetic": true,
    "id": "TEL-0008",
    "ticket_id": "WO-0032",
    "device_id": "DEV-106",
    "sampled_at": "2026-10-19T16:54:00Z",
    "source": "synthetic_read_only_snapshot",
    "fields": {
      "soc_percent": 26,
      "network_status": "online",
      "data_freshness_minutes": 180
    },
    "interpretation": "只读样本，不能仅凭该快照判断根因；不提供远程控制指令。"
  },
  {
    "is_synthetic": true,
    "id": "TEL-0009",
    "ticket_id": "WO-0036",
    "device_id": "DEV-018",
    "sampled_at": "2026-10-19T03:46:00Z",
    "source": "synthetic_read_only_snapshot",
    "fields": {
      "soc_percent": 58,
      "network_status": "online",
      "data_freshness_minutes": 180
    },
    "interpretation": "只读样本，不能仅凭该快照判断根因；不提供远程控制指令。"
  },
  {
    "is_synthetic": true,
    "id": "TEL-0010",
    "ticket_id": "WO-0040",
    "device_id": "DEV-100",
    "sampled_at": "2026-10-18T14:38:00Z",
    "source": "synthetic_read_only_snapshot",
    "fields": {
      "soc_percent": 80,
      "network_status": "online",
      "data_freshness_minutes": 180
    },
    "interpretation": "只读样本，不能仅凭该快照判断根因；不提供远程控制指令。"
  },
  {
    "is_synthetic": true,
    "id": "TEL-0011",
    "ticket_id": "WO-0044",
    "device_id": "DEV-184",
    "sampled_at": "2026-10-18T01:30:00Z",
    "source": "synthetic_read_only_snapshot",
    "fields": {
      "soc_percent": 79,
      "network_status": "online",
      "data_freshness_minutes": 2
    },
    "interpretation": "只读样本，不能仅凭该快照判断根因；不提供远程控制指令。"
  },
  {
    "is_synthetic": true,
    "id": "TEL-0012",
    "ticket_id": "WO-0048",
    "device_id": "DEV-080",
    "sampled_at": "2026-10-17T12:22:00Z",
    "source": "synthetic_read_only_snapshot",
    "fields": {
      "soc_percent": 59,
      "network_status": "online",
      "data_freshness_minutes": 2
    },
    "interpretation": "只读样本，不能仅凭该快照判断根因；不提供远程控制指令。"
  },
  {
    "is_synthetic": true,
    "id": "TEL-0013",
    "ticket_id": "WO-0052",
    "device_id": "DEV-158",
    "sampled_at": "2026-10-16T23:14:00Z",
    "source": "synthetic_read_only_snapshot",
    "fields": {
      "soc_percent": 66,
      "network_status": "online",
      "data_freshness_minutes": 2
    },
    "interpretation": "只读样本，不能仅凭该快照判断根因；不提供远程控制指令。"
  },
  {
    "is_synthetic": true,
    "id": "TEL-0014",
    "ticket_id": "WO-0056",
    "device_id": "DEV-054",
    "sampled_at": "2026-10-16T10:06:00Z",
    "source": "synthetic_read_only_snapshot",
    "fields": {
      "soc_percent": 79,
      "network_status": "online",
      "data_freshness_minutes": 2
    },
    "interpretation": "只读样本，不能仅凭该快照判断根因；不提供远程控制指令。"
  },
  {
    "is_synthetic": true,
    "id": "TEL-0015",
    "ticket_id": "WO-0060",
    "device_id": "DEV-158",
    "sampled_at": "2026-10-15T20:58:00Z",
    "source": "synthetic_read_only_snapshot",
    "fields": {
      "soc_percent": 35,
      "network_status": "online",
      "data_freshness_minutes": 2
    },
    "interpretation": "只读样本，不能仅凭该快照判断根因；不提供远程控制指令。"
  },
  {
    "is_synthetic": true,
    "id": "TEL-0016",
    "ticket_id": "WO-0064",
    "device_id": "DEV-044",
    "sampled_at": "2026-10-15T07:50:00Z",
    "source": "synthetic_read_only_snapshot",
    "fields": {
      "soc_percent": 37,
      "network_status": "online",
      "data_freshness_minutes": 2
    },
    "interpretation": "只读样本，不能仅凭该快照判断根因；不提供远程控制指令。"
  },
  {
    "is_synthetic": true,
    "id": "TEL-0017",
    "ticket_id": "WO-0068",
    "device_id": "DEV-128",
    "sampled_at": "2026-10-14T18:42:00Z",
    "source": "synthetic_read_only_snapshot",
    "fields": {
      "soc_percent": 75,
      "network_status": "online",
      "data_freshness_minutes": 2
    },
    "interpretation": "只读样本，不能仅凭该快照判断根因；不提供远程控制指令。"
  },
  {
    "is_synthetic": true,
    "id": "TEL-0018",
    "ticket_id": "WO-0072",
    "device_id": "DEV-018",
    "sampled_at": "2026-10-14T05:34:00Z",
    "source": "synthetic_read_only_snapshot",
    "fields": {
      "soc_percent": 70,
      "network_status": "online",
      "data_freshness_minutes": 2
    },
    "interpretation": "只读样本，不能仅凭该快照判断根因；不提供远程控制指令。"
  },
  {
    "is_synthetic": true,
    "id": "TEL-0019",
    "ticket_id": "WO-0076",
    "device_id": "DEV-104",
    "sampled_at": "2026-10-13T16:26:00Z",
    "source": "synthetic_read_only_snapshot",
    "fields": {
      "soc_percent": 77,
      "network_status": "online",
      "data_freshness_minutes": 2
    },
    "interpretation": "只读样本，不能仅凭该快照判断根因；不提供远程控制指令。"
  },
  {
    "is_synthetic": true,
    "id": "TEL-0020",
    "ticket_id": "WO-0080",
    "device_id": "DEV-016",
    "sampled_at": "2026-10-13T03:18:00Z",
    "source": "synthetic_read_only_snapshot",
    "fields": {
      "soc_percent": 49,
      "network_status": "online",
      "data_freshness_minutes": 2
    },
    "interpretation": "只读样本，不能仅凭该快照判断根因；不提供远程控制指令。"
  },
  {
    "is_synthetic": true,
    "id": "TEL-0021",
    "ticket_id": "WO-0084",
    "device_id": "DEV-074",
    "sampled_at": "2026-10-12T14:10:00Z",
    "source": "synthetic_read_only_snapshot",
    "fields": {
      "soc_percent": 47,
      "network_status": "online",
      "data_freshness_minutes": 2
    },
    "interpretation": "只读样本，不能仅凭该快照判断根因；不提供远程控制指令。"
  },
  {
    "is_synthetic": true,
    "id": "TEL-0022",
    "ticket_id": "WO-0088",
    "device_id": "DEV-178",
    "sampled_at": "2026-10-12T01:02:00Z",
    "source": "synthetic_read_only_snapshot",
    "fields": {
      "soc_percent": 62,
      "network_status": "online",
      "data_freshness_minutes": 2
    },
    "interpretation": "只读样本，不能仅凭该快照判断根因；不提供远程控制指令。"
  },
  {
    "is_synthetic": true,
    "id": "TEL-0023",
    "ticket_id": "WO-0092",
    "device_id": "DEV-070",
    "sampled_at": "2026-10-11T11:54:00Z",
    "source": "synthetic_read_only_snapshot",
    "fields": {
      "soc_percent": null,
      "network_status": "online",
      "data_freshness_minutes": 2
    },
    "interpretation": "只读样本，不能仅凭该快照判断根因；不提供远程控制指令。"
  },
  {
    "is_synthetic": true,
    "id": "TEL-0024",
    "ticket_id": "WO-0096",
    "device_id": "DEV-150",
    "sampled_at": "2026-10-10T22:46:00Z",
    "source": "synthetic_read_only_snapshot",
    "fields": {
      "soc_percent": 57,
      "network_status": "online",
      "data_freshness_minutes": 2
    },
    "interpretation": "只读样本，不能仅凭该快照判断根因；不提供远程控制指令。"
  },
  {
    "is_synthetic": true,
    "id": "TEL-0025",
    "ticket_id": "WO-0100",
    "device_id": "DEV-062",
    "sampled_at": "2026-10-10T09:38:00Z",
    "source": "synthetic_read_only_snapshot",
    "fields": {
      "soc_percent": 51,
      "network_status": "online",
      "data_freshness_minutes": 2
    },
    "interpretation": "只读样本，不能仅凭该快照判断根因；不提供远程控制指令。"
  },
  {
    "is_synthetic": true,
    "id": "TEL-0026",
    "ticket_id": "WO-0104",
    "device_id": "DEV-140",
    "sampled_at": "2026-10-09T20:30:00Z",
    "source": "synthetic_read_only_snapshot",
    "fields": {
      "soc_percent": 24,
      "network_status": "online",
      "data_freshness_minutes": 2
    },
    "interpretation": "只读样本，不能仅凭该快照判断根因；不提供远程控制指令。"
  },
  {
    "is_synthetic": true,
    "id": "TEL-0027",
    "ticket_id": "WO-0108",
    "device_id": "DEV-044",
    "sampled_at": "2026-10-09T07:22:00Z",
    "source": "synthetic_read_only_snapshot",
    "fields": {
      "soc_percent": 20,
      "network_status": "online",
      "data_freshness_minutes": 2
    },
    "interpretation": "只读样本，不能仅凭该快照判断根因；不提供远程控制指令。"
  },
  {